{
  "schema_version": "1.0",
  "message_type": "command_response",
  "message_id": "CWS-TEST-0123456789abcdef-1",
  "device_id": "CWS-TEST",
  "boot_id": "0123456789abcdef",
  "sequence": 1,
  "time": {
    "uptime_ms": 2500,
    "synchronized": false,
    "unix_s": null
  },
  "request_id": "integration-1",
  "status": "applied",
  "error": "",
  "configuration_revision": 3,
  "result": {
    "revision": 3,
    "calibration_revision": 1
  }
}
